{
  "$schema": "https://json-schema.org/draft/2020-12/schema",
  "title": "timeline feed",
  "type": "array",
  "items": {
    "additionalProperties": false,
    "description": "One dated event, traceable to the extraction(s) that supplied it.",
    "properties": {
      "date": {
        "title": "Date",
        "type": "string"
      },
      "category": {
        "title": "Category",
        "type": "string"
      },
      "title": {
        "title": "Title",
        "type": "string"
      },
      "ref": {
        "default": "",
        "title": "Ref",
        "type": "string"
      },
      "parties": {
        "items": {
          "type": "string"
        },
        "title": "Parties",
        "type": "array"
      },
      "detail": {
        "default": "",
        "title": "Detail",
        "type": "string"
      },
      "source": {
        "title": "Source",
        "type": "string"
      },
      "also_sources": {
        "items": {
          "type": "string"
        },
        "title": "Also Sources",
        "type": "array"
      },
      "citation": {
        "$ref": "#/$defs/Citation"
      }
    },
    "required": [
      "date",
      "category",
      "title",
      "source",
      "citation"
    ],
    "title": "TimelineEntry",
    "type": "object"
  },
  "$defs": {
    "Citation": {
      "additionalProperties": false,
      "description": "Structured provenance for a feed item or a single figure.\n\nMirrors :class:`watermark.hydrology.model.ProvenancedValue`'s evidence discipline so the\nwhole bundle speaks one provenance language: ``source_kind`` says where the value\ncame from, ``source`` is the citable artifact (a repo-relative ``data/`` path, an\nexternal dataset label, a permit/instrument number), ``page`` locates it within a\nmulti-page source, and ``verified`` is derived so a consumer never re-computes it.",
      "properties": {
        "source": {
          "anyOf": [
            {
              "type": "string"
            },
            {
              "type": "null"
            }
          ],
          "default": null,
          "title": "Source"
        },
        "source_kind": {
          "default": "document",
          "enum": [
            "document",
            "connector",
            "reference",
            "assumption",
            "derived"
          ],
          "title": "Source Kind",
          "type": "string"
        },
        "page": {
          "anyOf": [
            {
              "type": "integer"
            },
            {
              "type": "null"
            }
          ],
          "default": null,
          "title": "Page"
        },
        "confidence": {
          "default": "medium",
          "enum": [
            "high",
            "medium",
            "low"
          ],
          "title": "Confidence",
          "type": "string"
        },
        "note": {
          "anyOf": [
            {
              "type": "string"
            },
            {
              "type": "null"
            }
          ],
          "default": null,
          "title": "Note"
        },
        "verified": {
          "description": "True when grounded in a record or a live gauge (``[verified]`` in prose).",
          "readOnly": true,
          "title": "Verified",
          "type": "boolean"
        }
      },
      "required": [
        "verified"
      ],
      "title": "Citation",
      "type": "object"
    }
  }
}
