[
  {
    "date": "2021-02-11",
    "category": "zoning_amendment",
    "title": "American Township Zoning Resolution — amended & adopted by Trustees",
    "ref": "amtwp-zoning-2021-02-11",
    "parties": [],
    "detail": "defines Data Center / Hyperscale Data Center; M-2 conditional use (11.2.4)",
    "source": "lacrpc/american-township-zoning.zoning.yaml",
    "also_sources": [],
    "citation": {
      "source": "lacrpc/american-township-zoning.zoning.yaml",
      "source_kind": "document",
      "page": null,
      "confidence": "medium",
      "note": null,
      "verified": true
    }
  },
  {
    "date": "2023-05-05",
    "category": "npdes_public_notice",
    "title": "NPDES 2PK00002*LD (Shawnee II WWTP) — public notice",
    "ref": "2PK00002*LD",
    "parties": [
      "Allen County Board of Commissioners",
      "Shawnee II WWTP"
    ],
    "detail": "action modification; receiving Ottawa River",
    "source": "oepa/oepa-2PK00002-shawnee-ii-permit.npdes.yaml",
    "also_sources": [],
    "citation": {
      "source": "oepa/oepa-2PK00002-shawnee-ii-permit.npdes.yaml",
      "source_kind": "document",
      "page": null,
      "confidence": "medium",
      "note": null,
      "verified": true
    }
  },
  {
    "date": "2023-05-12",
    "category": "npdes_public_notice",
    "title": "NPDES 2PK00002*LD (Shawnee II Wastewater Treatment Works (Shawnee II WWTP)) — public notice",
    "ref": "2PK00002*LD",
    "parties": [
      "Allen County Board of Commissioners, 4140 Diller Rd, Lima, Ohio 45807",
      "Shawnee II Wastewater Treatment Works (Shawnee II WWTP)"
    ],
    "detail": "action modification; receiving Ottawa River",
    "source": "oepa/oepa-2PK00002-shawnee-ii-fact-sheet-2023.npdes.yaml",
    "also_sources": [],
    "citation": {
      "source": "oepa/oepa-2PK00002-shawnee-ii-fact-sheet-2023.npdes.yaml",
      "source_kind": "document",
      "page": null,
      "confidence": "medium",
      "note": null,
      "verified": true
    }
  },
  {
    "date": "2023-06-11",
    "category": "npdes_comment_deadline",
    "title": "NPDES 2PK00002*LD (Shawnee II Wastewater Treatment Works (Shawnee II WWTP)) — comment period ends",
    "ref": "2PK00002*LD",
    "parties": [
      "Allen County Board of Commissioners, 4140 Diller Rd, Lima, Ohio 45807",
      "Shawnee II Wastewater Treatment Works (Shawnee II WWTP)"
    ],
    "detail": "",
    "source": "oepa/oepa-2PK00002-shawnee-ii-fact-sheet-2023.npdes.yaml",
    "also_sources": [],
    "citation": {
      "source": "oepa/oepa-2PK00002-shawnee-ii-fact-sheet-2023.npdes.yaml",
      "source_kind": "document",
      "page": null,
      "confidence": "medium",
      "note": null,
      "verified": true
    }
  }
]
